{
  "schemaVersion": "1.0.0",
  "run": {
    "id": "run-1",
    "workflowId": "flux",
    "workflowVersion": null,
    "status": "completed",
    "createdAt": null,
    "completedAt": "2026-10-25T03:42:17Z",
    "modelVersions": []
  },
  "organism": {
    "chassisId": "bacterium",
    "taxonId": null,
    "taxonName": "E. coli",
    "strainId": null,
    "strainName": null
  },
  "condition": {
    "id": "cond-1",
    "temperatureC": null,
    "salinityMolL": null,
    "pH": null,
    "timepoint": null,
    "media": null,
    "oxygenation": null,
    "other": {}
  },
  "artifacts": [
    {
      "id": "flux_table",
      "uri": "gs://b/x.csv",
      "role": "flux-table",
      "mediaType": "text/csv",
      "sha256": "d05dbe704b717389fec419069328fd80d72d55af57a792b3a9aa0ec7d8247397"
    }
  ],
  "analyses": {
    "flux": {
      "status": "available",
      "method": "COBRApy 0.29.0 pFBA",
      "artifactIds": [
        "flux_table"
      ],
      "modelId": "iML1515",
      "objective": "BIOMASS",
      "results": [
        {
          "reactionId": "PFK",
          "flux": 7.4,
          "unit": "mmol/gDW/h",
          "conditionId": "cond-1",
          "lowerBound": 0.0,
          "upperBound": 1000.0
        }
      ]
    },
    "yield": {
      "status": "available",
      "method": "COBRApy 0.29.0 FBA",
      "artifactIds": [],
      "results": [
        {
          "metricId": "succ_per_glc",
          "value": 1.12,
          "unit": "mol/mol",
          "kind": "predicted",
          "conditionId": "cond-1"
        }
      ]
    }
  }
}
